{
  "kind": "opportunity_report",
  "title": "Funding carry with volatility filter deterministic fixture opportunity report",
  "created_by": "codex",
  "created_at": "2026-06-09T00:00:00+00:00",
  "strategy_name": "funding_carry_vol_filter",
  "strategy_version": "0.1.0",
  "data_window": {
    "start_ts": "2024-01-01T00:00:00+00:00",
    "end_ts": "2024-01-01T00:01:00+00:00"
  },
  "opportunity_count": 1,
  "opportunities": [
    {
      "strategy": "funding_carry_vol_filter",
      "version": "0.1.0",
      "legs": [
        {
          "exchange": "binance",
          "market_type": "spot",
          "symbol": "BTC-USDT",
          "side": "buy",
          "price": "100",
          "qty": "10",
          "role": "taker"
        },
        {
          "exchange": "binance",
          "market_type": "perp",
          "symbol": "BTC-USDT",
          "side": "sell",
          "price": "100",
          "qty": "10",
          "role": "taker"
        }
      ],
      "gross_edge_usd": "3.000",
      "fees_usd": "0",
      "slippage_est_usd": "0",
      "net_edge_usd": "3.000",
      "capacity_usd": "1000",
      "confidence": "0.5950",
      "risk_score": "0.4050",
      "grade": "A",
      "failure_modes": [],
      "data_window": {
        "start_ts": "2024-01-01T00:00:00+00:00",
        "end_ts": "2024-01-01T00:00:00+00:00"
      },
      "metadata": {
        "funding_rate": "0.003",
        "hedge_direction": "spot_long_perp_short",
        "spot_perp_basis_bps": "0.00",
        "mark_index_divergence_bps": "0.00",
        "recent_price_move_bps": "100.00",
        "recent_price_move_source": "trade",
        "index_price": "100"
      }
    }
  ],
  "result_hash": "1734b08286d0f16d20b257003522e8f1157c2990619b6b321e6c534af50e9d71"
}
