{
  "kind": "opportunity_report",
  "title": "Mark/index dislocation blocked-data fixture",
  "created_by": "codex",
  "created_at": "2026-06-10T00:00:00+00:00",
  "strategy_name": "mark_index_dislocation_alert",
  "strategy_version": "0.1.0-research",
  "data_window": {
    "start_ts": "2026-06-08T00:00:00+00:00",
    "end_ts": "2026-06-09T00:00:00+00:00"
  },
  "opportunity_count": 0,
  "opportunities": [],
  "result_hash": null
}
