{
  "kind": "opportunity_report",
  "title": "Perp premium z-score mean reversion blocked-data fixture opportunity report",
  "created_by": "codex",
  "created_at": "2026-06-09T00:00:00+00:00",
  "strategy_name": "perp_premium_zscore_mean_reversion",
  "strategy_version": "0.1.0",
  "data_window": {
    "start_ts": "2026-06-08T00:00:00+00:00",
    "end_ts": "2026-06-09T00:00:00+00:00"
  },
  "opportunity_count": 0,
  "opportunities": [],
  "result_hash": "940b4edecfc5d14cb63710eb2e32d03fb08960a75ca64f7c945f9e76d12947d1"
}
