{
  "kind": "opportunity_report",
  "title": "Order-book imbalance short-horizon filter blocked-data fixture opportunity report",
  "created_by": "codex",
  "created_at": "2026-06-09T00:00:00+00:00",
  "strategy_name": "orderbook_imbalance_filter",
  "strategy_version": "0.1.0",
  "data_window": {
    "start_ts": "2026-06-08T00:00:00+00:00",
    "end_ts": "2026-06-09T00:00:00+00:00"
  },
  "opportunity_count": 0,
  "opportunities": [],
  "result_hash": "8251b753cf76e58cfbc85c13036cab00bbbc06f7d3e568ff2075cd24ba7179d8"
}
